7294947;ZURIMA  JOSEFINA MORGADO DE BOTTINI;584166330731;x;0;0;DISTRITO CAPITAL;LIBERTADOR;LA VEGA;UNIDAD EDUCATIVA BOLIVARIANA PEDRO FONTES;N/A;MISION VENEZUELA BELLA;1X10 ZURIMA  JOSEFINA MORGADO DE BOTTINI;7294947
29621782;ZURIMA ALESSANDRA BOTTINI MORGADO;584166372011;x;0;0;DISTRITO CAPITAL;LIBERTADOR;LA VEGA;UNIDAD EDUCATIVA BOLIVARIANA PEDRO FONTES;N/A;MISION VENEZUELA BELLA;1X10 ZURIMA  JOSEFINA MORGADO DE BOTTINI;7294948
2385710;GLORIA RUEDA DE MORGADO;582464313880;x;0;0;GUARICO;JUAN GERMAN ROSCIO;SAN JUAN DE LOS MORROS;LICEO BOLIVARIANO VICENTE EMILIO SOJO;N/A;MISION VENEZUELA BELLA;1X10 ZURIMA  JOSEFINA MORGADO DE BOTTINI;7294949
849581;MANUEL CELESTINO MORGADO;582464313880;x;0;0;GUARICO;JUAN GERMAN ROSCIO;SAN JUAN DE LOS MORROS;LICEO BOLIVARIANO VICENTE EMILIO SOJO;N/A;MISION VENEZUELA BELLA;1X10 ZURIMA  JOSEFINA MORGADO DE BOTTINI;7294950
7281945;MAIGUALIDA MORGADO RUEDA;584124602123;x;0;0;GUARICO;JUAN GERMAN ROSCIO;SAN JUAN DE LOS MORROS;LICEO BOLIVARIANO JUAN GERMAN ROSCIO;N/A;MISION VENEZUELA BELLA;1X10 ZURIMA  JOSEFINA MORGADO DE BOTTINI;7294951
6915722;LUIS OMAR VIGIL LINARES;584120265244;x;0;0;MIRANDA;PLAZA;GUARENAS;CENTRO DE EDUCACION BOLIVARIANO TERRAZAS DEL ESTE;N/A;MISION VENEZUELA BELLA;1X10 ZURIMA  JOSEFINA MORGADO DE BOTTINI;7294952
18584974;AQUILES ANTONIO MATA BOLLEDO;584243754258;x;0;0;GUARICO;MIRANDA ;CALABOZO;GRUPO ESCOLAR JOSE RAFAEL VISO RODRIGUEZ;N/A;MISION VENEZUELA BELLA;1X10 ZURIMA  JOSEFINA MORGADO DE BOTTINI;7294953
4939520;LUIS EDUARDO OLIVIER ROBERTSON;584121269035;x;0;0;DISTRITO CAPITAL;LIBERTADOR;SAN PEDRO;COLEGIO SAN PEDRO;N/A;MISION VENEZUELA BELLA;1X10 ZURIMA  JOSEFINA MORGADO DE BOTTINI;7294954
